{
  "schemaVersion": "1.0.0",
  "publicationId": "33333333-3333-4333-8333-333333333333",
  "transitionId": "31313131-3131-4131-8131-313131313131",
  "lifecycleRevision": 1,
  "previousState": null,
  "state": "queued",
  "attemptCount": 0,
  "installationId": 9001,
  "repositoryNodeId": "R_fixture_target",
  "pullRequestNodeId": "PR_target_42",
  "pullRequestNumber": 42,
  "generation": 7,
  "latestObservedGeneration": 7,
  "assessmentId": "11111111-1111-4111-8111-111111111111",
  "assessmentHeadSha": "aaaaaaaaaaaaaaaaaaaaaaaaaaaaaaaaaaaaaaaa",
  "latestObservedHeadSha": "aaaaaaaaaaaaaaaaaaaaaaaaaaaaaaaaaaaaaaaa",
  "fenceState": "current",
  "sourceFenceState": "current",
  "renderedSourceSetDigest": "e17b7785386dc24c25bd65dbfa8e3bbf10db321beae85443f7eeb9b7f7bc94c4",
  "preWriteVisibilityValidationId": "44444444-4444-4444-8444-444444444444",
  "postWriteVisibilityValidationId": null,
  "latestVisibilityStateDigest": "875fac691c35d90450e98fcc33017b9672d8dd63899b9d5b7018bf6773dee77b",
  "preWriteRetentionRevision": 1,
  "postWriteRetentionRevision": null,
  "postWriteRetentionState": null,
  "comment": {
    "state": "pending",
    "commentId": null,
    "markerVersion": "1",
    "lastAttemptAt": null,
    "writeStartedAt": null,
    "writeCompletedAt": null
  },
  "check": {
    "state": "queued",
    "checkRunId": null,
    "conclusion": "none",
    "lastAttemptAt": null,
    "writeStartedAt": null,
    "writeCompletedAt": null
  },
  "createdAt": "2026-07-21T00:00:01Z",
  "updatedAt": "2026-07-21T00:00:01Z",
  "policyVersion": "policy-v1",
  "policyDigest": "a46f0cc5bf024f57933cd9cbad5ad5c7adc5308be8203472ac2a2408a2df5a94",
  "preWriteRetentionTransitionId": "99999999-9999-4999-8999-999999999999",
  "postWriteRetentionTransitionId": null,
  "postCheckVisibilityValidationId": null,
  "postCheckRetentionRevision": null,
  "postCheckRetentionTransitionId": null,
  "postCheckRetentionState": null,
  "outputCursorId": "67676767-6767-4767-8767-676767676767",
  "outputCursorRevision": 1,
  "outputCursorDigest": "f12583227f9690e769f1166d33b981e92ea2583f128940b324f3c844387e0684",
  "retentionHeadRevision": 1,
  "retentionHeadDigest": "a2bbb4c1dc869bfc3abf17f718f4611464bb8a9ddb8ea95aa3e843ac7feaf926",
  "retentionSnapshotToken": "60bfe0b1faa096495ba4c80f87439c8f28debd6472f2ac5da37c900dde81b653",
  "publicationHeadRevision": 1,
  "publicationHeadDigest": "03778d1f67a22eb1fc023698ebeb3dfac76fc17fd28d21954f4d79af4a5cd532",
  "publicationSnapshotToken": "b1280cb19043f6d0da7110e42f627d722904ff027a09a6b72a655098ae40ff79",
  "commentOwnershipObservationId": null,
  "engineVersion": "engine-v1",
  "engineDigest": "09775a319223b237b406d8722117e95abb314375583bcb90c14ab8ecde8dad70",
  "commentInventoryObservationId": null
}
