{
  "schemaVersion": "1.0.0",
  "publicationId": "33333333-3333-4333-8333-333333333333",
  "installationId": 9001,
  "repositoryNodeId": "R_fixture_target",
  "pullRequestNodeId": "PR_target_42",
  "pullRequestNumber": 42,
  "generation": 7,
  "latestObservedGeneration": 7,
  "assessmentId": "11111111-1111-4111-8111-111111111111",
  "assessmentHeadSha": "aaaaaaaaaaaaaaaaaaaaaaaaaaaaaaaaaaaaaaaa",
  "latestObservedHeadSha": "aaaaaaaaaaaaaaaaaaaaaaaaaaaaaaaaaaaaaaaa",
  "fenceState": "current",
  "sourceFenceState": "current",
  "renderedSourceSetDigest": "e17b7785386dc24c25bd65dbfa8e3bbf10db321beae85443f7eeb9b7f7bc94c4",
  "preWriteVisibilityValidationId": "44444444-4444-4444-8444-444444444444",
  "postWriteVisibilityValidationId": "55555555-5555-4555-8555-555555555555",
  "latestVisibilityStateDigest": "98bd8a7f81ebfc69271b079716a96df2ea8c0022315d67788774edcaad083b57",
  "preWriteRetentionRevision": 1,
  "postWriteRetentionRevision": 1,
  "postWriteRetentionState": "retained",
  "comment": {
    "state": "published",
    "commentId": 123456,
    "markerVersion": "1",
    "lastAttemptAt": "2026-07-21T00:00:03Z",
    "writeStartedAt": "2026-07-21T00:00:02.500Z",
    "writeCompletedAt": "2026-07-21T00:00:03Z"
  },
  "check": {
    "state": "completed",
    "checkRunId": 789012,
    "conclusion": "success",
    "lastAttemptAt": "2026-07-21T00:00:05Z",
    "writeStartedAt": "2026-07-21T00:00:04.500Z",
    "writeCompletedAt": "2026-07-21T00:00:05Z"
  },
  "createdAt": "2026-07-21T00:00:01Z",
  "updatedAt": "2026-07-21T00:00:05.500Z",
  "transitionId": "33333333-3131-4131-8131-313131313131",
  "lifecycleRevision": 3,
  "previousState": "publishing",
  "state": "published",
  "attemptCount": 1,
  "policyVersion": "policy-v1",
  "policyDigest": "a46f0cc5bf024f57933cd9cbad5ad5c7adc5308be8203472ac2a2408a2df5a94",
  "preWriteRetentionTransitionId": "99999999-9999-4999-8999-999999999999",
  "postWriteRetentionTransitionId": "99999999-9999-4999-8999-999999999999",
  "postCheckVisibilityValidationId": "56565656-5656-4656-8656-565656565656",
  "postCheckRetentionRevision": 1,
  "postCheckRetentionTransitionId": "99999999-9999-4999-8999-999999999999",
  "postCheckRetentionState": "retained",
  "outputCursorId": "67676767-6767-4767-8767-676767676767",
  "outputCursorRevision": 3,
  "outputCursorDigest": "2d8d8287f920c6c13ec5163298fe3a07c4a685dcb2a7f71e4a8c3de71e4b1e6b",
  "retentionHeadRevision": 1,
  "retentionHeadDigest": "a2bbb4c1dc869bfc3abf17f718f4611464bb8a9ddb8ea95aa3e843ac7feaf926",
  "retentionSnapshotToken": "9cae632643ff7a37e4906a3e300b69e2a5a7322e4f91e9ad13af1631eba08de6",
  "publicationHeadRevision": 3,
  "publicationHeadDigest": "1556436c4bd50641ed0130573fd8f08a6a95284a13dfc0acc245796a1fde2541",
  "publicationSnapshotToken": "b1280cb19043f6d0da7110e42f627d722904ff027a09a6b72a655098ae40ff79",
  "commentOwnershipObservationId": "68686868-6868-4868-8868-686868686868",
  "engineVersion": "engine-v1",
  "engineDigest": "09775a319223b237b406d8722117e95abb314375583bcb90c14ab8ecde8dad70",
  "commentInventoryObservationId": "78787878-1111-4111-8111-111111111111"
}
