{
  "schemaVersion": "1.0.0",
  "publicationId": "44444444-4444-4444-8444-444444444444",
  "transitionId": "42424242-4242-4242-8242-424242424242",
  "lifecycleRevision": 2,
  "previousState": "queued",
  "state": "publishing",
  "attemptCount": 1,
  "installationId": 9001,
  "repositoryNodeId": "R_fixture_target",
  "pullRequestNodeId": "PR_target_42",
  "pullRequestNumber": 42,
  "generation": 6,
  "latestObservedGeneration": 6,
  "assessmentId": "11111111-1111-4111-8111-111111111111",
  "assessmentHeadSha": "aaaaaaaaaaaaaaaaaaaaaaaaaaaaaaaaaaaaaaaa",
  "latestObservedHeadSha": "aaaaaaaaaaaaaaaaaaaaaaaaaaaaaaaaaaaaaaaa",
  "fenceState": "current",
  "sourceFenceState": "current",
  "renderedSourceSetDigest": "e17b7785386dc24c25bd65dbfa8e3bbf10db321beae85443f7eeb9b7f7bc94c4",
  "preWriteVisibilityValidationId": "44444444-4444-4444-8444-444444444444",
  "postWriteVisibilityValidationId": null,
  "latestVisibilityStateDigest": "875fac691c35d90450e98fcc33017b9672d8dd63899b9d5b7018bf6773dee77b",
  "preWriteRetentionRevision": 1,
  "postWriteRetentionRevision": null,
  "postWriteRetentionState": null,
  "comment": {
    "state": "publishing",
    "commentId": null,
    "markerVersion": "1",
    "lastAttemptAt": "2026-07-21T00:00:02Z",
    "writeStartedAt": "2026-07-21T00:00:02Z",
    "writeCompletedAt": null
  },
  "check": {
    "state": "in_progress",
    "checkRunId": null,
    "conclusion": "none",
    "lastAttemptAt": "2026-07-21T00:00:02Z",
    "writeStartedAt": "2026-07-21T00:00:02Z",
    "writeCompletedAt": null
  },
  "createdAt": "2026-07-21T00:00:01Z",
  "updatedAt": "2026-07-21T00:00:02Z",
  "policyVersion": "policy-v1",
  "policyDigest": "a46f0cc5bf024f57933cd9cbad5ad5c7adc5308be8203472ac2a2408a2df5a94",
  "preWriteRetentionTransitionId": "99999999-9999-4999-8999-999999999999",
  "postWriteRetentionTransitionId": null,
  "postCheckVisibilityValidationId": null,
  "postCheckRetentionRevision": null,
  "postCheckRetentionTransitionId": null,
  "postCheckRetentionState": null,
  "outputCursorId": "67676767-6767-4767-8767-676767676767",
  "outputCursorRevision": 1,
  "outputCursorDigest": "f12583227f9690e769f1166d33b981e92ea2583f128940b324f3c844387e0684",
  "retentionHeadRevision": 1,
  "retentionHeadDigest": "a2bbb4c1dc869bfc3abf17f718f4611464bb8a9ddb8ea95aa3e843ac7feaf926",
  "retentionSnapshotToken": "60bfe0b1faa096495ba4c80f87439c8f28debd6472f2ac5da37c900dde81b653",
  "publicationHeadRevision": 2,
  "publicationHeadDigest": "a01e882259da0904d76fe0b8950b6e45c94b13884512706918ad51add9adffdb",
  "publicationSnapshotToken": "4d2856b7a96aab391e4306805cb7fde4e94ff9703883acc80385cb44aa3adfaa",
  "commentOwnershipObservationId": null,
  "engineVersion": "engine-v1",
  "engineDigest": "09775a319223b237b406d8722117e95abb314375583bcb90c14ab8ecde8dad70",
  "commentInventoryObservationId": null
}
