{
  "schemaVersion": "1.0.0",
  "publicationId": "33333333-3333-4333-8333-333333333333",
  "installationId": 9001,
  "repositoryNodeId": "R_fixture_target",
  "pullRequestNodeId": "PR_target_42",
  "pullRequestNumber": 42,
  "generation": 7,
  "latestObservedGeneration": 8,
  "assessmentId": "11111111-1111-4111-8111-111111111111",
  "assessmentHeadSha": "aaaaaaaaaaaaaaaaaaaaaaaaaaaaaaaaaaaaaaaa",
  "latestObservedHeadSha": "cccccccccccccccccccccccccccccccccccccccc",
  "fenceState": "repair_queued",
  "sourceFenceState": "current",
  "renderedSourceSetDigest": "e17b7785386dc24c25bd65dbfa8e3bbf10db321beae85443f7eeb9b7f7bc94c4",
  "preWriteVisibilityValidationId": "44444444-4444-4444-8444-444444444444",
  "postWriteVisibilityValidationId": "55555555-5555-4555-8555-555555555555",
  "latestVisibilityStateDigest": "875fac691c35d90450e98fcc33017b9672d8dd63899b9d5b7018bf6773dee77b",
  "preWriteRetentionRevision": 1,
  "postWriteRetentionRevision": 1,
  "postWriteRetentionState": "retained",
  "comment": {
    "state": "refreshing",
    "commentId": 123456,
    "markerVersion": "1",
    "lastAttemptAt": "2026-07-21T00:00:05Z",
    "writeStartedAt": "2026-07-21T00:00:05Z",
    "writeCompletedAt": null
  },
  "check": {
    "state": "retrying",
    "checkRunId": 789012,
    "conclusion": "none",
    "lastAttemptAt": "2026-07-21T00:00:05Z",
    "writeStartedAt": "2026-07-21T00:00:05Z",
    "writeCompletedAt": null
  },
  "createdAt": "2026-07-21T00:00:01Z",
  "updatedAt": "2026-07-21T00:00:06Z",
  "transitionId": "61616161-6161-4161-8161-616161616161",
  "lifecycleRevision": 4,
  "previousState": "published",
  "state": "repair_queued",
  "attemptCount": 2,
  "policyVersion": "policy-v1",
  "policyDigest": "a46f0cc5bf024f57933cd9cbad5ad5c7adc5308be8203472ac2a2408a2df5a94",
  "preWriteRetentionTransitionId": "99999999-9999-4999-8999-999999999999",
  "postWriteRetentionTransitionId": "99999999-9999-4999-8999-999999999999",
  "postCheckVisibilityValidationId": null,
  "postCheckRetentionRevision": null,
  "postCheckRetentionTransitionId": null,
  "postCheckRetentionState": null,
  "outputCursorId": "67676767-6767-4767-8767-676767676767",
  "outputCursorRevision": 3,
  "outputCursorDigest": "2d8d8287f920c6c13ec5163298fe3a07c4a685dcb2a7f71e4a8c3de71e4b1e6b",
  "retentionHeadRevision": 1,
  "retentionHeadDigest": "a2bbb4c1dc869bfc3abf17f718f4611464bb8a9ddb8ea95aa3e843ac7feaf926",
  "retentionSnapshotToken": "9cae632643ff7a37e4906a3e300b69e2a5a7322e4f91e9ad13af1631eba08de6",
  "publicationHeadRevision": 4,
  "publicationHeadDigest": "7c0b4a1036ff30dc88b3922003a3cf5c923229acdabcb2d5a90a392d099b3558",
  "publicationSnapshotToken": "b1280cb19043f6d0da7110e42f627d722904ff027a09a6b72a655098ae40ff79",
  "commentOwnershipObservationId": "68686868-6868-4868-8868-686868686868",
  "engineVersion": "engine-v1",
  "engineDigest": "09775a319223b237b406d8722117e95abb314375583bcb90c14ab8ecde8dad70",
  "commentInventoryObservationId": "78787878-1111-4111-8111-111111111111"
}
